{
  "artifact_sha256": "d37a8c5e7971ea9e277ebc5f0a9bd94e6336095bb79650640816ace75ddc8570",
  "created_at": "2026-08-24T12:56:21.436603+00:00",
  "entries": [
    {
      "bytes": 3640,
      "executable": false,
      "path": "INSTRUCTIONS.md",
      "sha256": "87a98a3e9bb2dd0a4dd04bc629df2348f64bb6fce3d7b5c59c5e01dc99954c51"
    },
    {
      "bytes": 2909,
      "executable": false,
      "path": "PAGE.md",
      "sha256": "db0d106d881109c22c7ba322935ab3f78d715d3e483bae33cdc7780dae23b766"
    },
    {
      "bytes": 133932,
      "executable": false,
      "path": "images/box.png",
      "sha256": "53bc4686db8da737a10799609230da23977437aaad10972ece285dc8a37a711d"
    },
    {
      "bytes": 147047,
      "executable": false,
      "path": "images/detail.png",
      "sha256": "6d2d751a0ecdf01ab0c344f7d0d7c1e2b650fe2084e275c1d816dbe0507c3a4c"
    },
    {
      "bytes": 338848,
      "executable": false,
      "path": "images/hero.png",
      "sha256": "0a8689290ca1a528e4b02d8975594b82f3bf25e3adf41120aeb67069753997c3"
    },
    {
      "bytes": 325178,
      "executable": false,
      "path": "images/parts.png",
      "sha256": "74e0b1266a1e962acc656ece498a073c797cfec70a9a30cf29e4afd7c740f443"
    },
    {
      "bytes": 372576,
      "executable": false,
      "path": "images/play.png",
      "sha256": "b7f8a6ca64f674d83edc719a17c394d397587f3334359b69de1cffe12d68189c"
    },
    {
      "bytes": 7890,
      "executable": false,
      "path": "product.json",
      "sha256": "4e4becb106bcf5ce92c6df7f9b41a45991819ed6b3643402cebaf4f3c1fb33c6"
    }
  ],
  "schema_version": 1,
  "total_bytes": 1332020
}
